{
  "schema_version": 1,
  "source_repository": "Ran-sh/chatgpt_workflow",
  "workflow_version": "1.7.0",
  "project": "<target-repository-name>",
  "installed_at": "2026-01-01T00:00:00.000Z",
  "generated_files": [
    "docs/agent-workflow.md",
    "docs/agent-short-triggers.md",
    "docs/agent-tasks/README.md",
    "docs/agent-tasks/TEMPLATE_TASK.json",
    "docs/agent-tasks/TEMPLATE_IMPLEMENT.md",
    "docs/agent-tasks/TEMPLATE_TEST_ONLY.md",
    "docs/agent-tasks/TEMPLATE_REVIEW_ONLY.md",
    "docs/agent-results/README.md",
    ".agent-workflow/schema/task-contract.schema.json",
    ".agent-workflow/schema/result-contract.schema.json",
    ".agent-workflow/validator/validate-contract.mjs",
    "docs/.agent-workflow-install.json"
  ],
  "generated_dirs": [
    ".agent-workflow",
    ".agent-workflow/schema",
    ".agent-workflow/validator",
    "docs/agent-tasks",
    "docs/agent-results"
  ],
  "project_facts": {
    "languages": [],
    "package_manager": null,
    "build_command": null,
    "test_command": null,
    "ci": []
  }
}
